Imagen-src,Titulo,Precio
https://cdn.media.amplience.net/i/primark/991075417514_01,Camiseta básica lisa,"3,00€"
https://cdn.media.amplience.net/i/primark/991068773528_01,Chaqueta acolchada con capucha básica,"18,00€"
https://cdn.media.amplience.net/i/primark/991068194414_01,Sudadera Essential con media cremallera,"11,00€"
https://cdn.media.amplience.net/i/primark/991068194108_01,Sudadera Essential con media cremallera,"11,00€"
https://cdn.media.amplience.net/i/primark/991068194804_01,Sudadera Essential con media cremallera,"11,00€"
https://cdn.media.amplience.net/i/primark/991068194528_01,Sudadera Essential con media cremallera,"11,00€"
https://cdn.media.amplience.net/i/primark/991051200706_01,Joggers con bajos ajustados,"7,00€"
https://cdn.media.amplience.net/i/primark/991070551528_01,Cazadora bómber con capucha,"18,00€"
https://cdn.media.amplience.net/i/primark/991068773804_01,Chaqueta acolchada con capucha básica,"18,00€"
https://cdn.media.amplience.net/i/primark/991051200804_01,Joggers con bajos ajustados,"7,00€"
https://cdn.media.amplience.net/i/primark/991067830706_01,Sudadera con capucha de corte recto Essential,"11,00€"
https://cdn.media.amplience.net/i/primark/991067830804_01,Sudadera con capucha de corte recto Essential,"11,00€"
https://cdn.media.amplience.net/i/primark/991082446804_01,Chaqueta universitaria de los Chicago Bulls de la NBA,"60,00€"
https://cdn.media.amplience.net/i/primark/991060297804_01,Pantalones cargo elásticos técnicos de corte holgado,"25,00€"
https://cdn.media.amplience.net/i/primark/991051200528_01,Joggers con bajos ajustados,"7,00€"
https://cdn.media.amplience.net/i/primark/991056639804_01,Joggers estilo cargo con bajos ajustados,"16,00€"
https://cdn.media.amplience.net/i/primark/991051956804_01,Sudadera con cuello redondo,"7,50€"
https://cdn.media.amplience.net/i/primark/991067830528_01,Sudadera con capucha de corte recto Essential,"11,00€"
https://cdn.media.amplience.net/i/primark/991051956528_01,Sudadera con cuello redondo,"7,50€"
https://cdn.media.amplience.net/i/primark/991070551416_01,Cazadora bómber con capucha,"18,00€"
https://cdn.media.amplience.net/i/primark/991070551804_01,Cazadora bómber con capucha,"18,00€"
https://cdn.media.amplience.net/i/primark/991051956706_01,Sudadera con cuello redondo,"7,50€"
https://cdn.media.amplience.net/i/primark/991076671716_01,Snuddie de Rick y Morty para hombre,"26,00€"
https://cdn.media.amplience.net/i/primark/991038953804_01,Pantalones de traje de corte recto,"12,00€"
https://cdn.media.amplience.net/i/primark/991068748804_01,Chaleco acolchado con cremallera,"15,00€"
https://cdn.media.amplience.net/i/primark/991068194706_01,Sudadera Essential con media cremallera,"11,00€"
https://cdn.media.amplience.net/i/primark/991086243706_01,Pijama polar de manga larga,"12,00€"
https://cdn.media.amplience.net/i/primark/991076757804_01,Vaqueros pitillo elásticos,"18,00€"
https://cdn.media.amplience.net/i/primark/991072867716_01,Camiseta térmica de manga larga,"13,00€"
https://cdn.media.amplience.net/i/primark/991075417112_01,Camiseta básica lisa,"3,00€"
https://cdn.media.amplience.net/i/primark/991075417368_01,Camiseta básica lisa,"3,00€"
https://cdn.media.amplience.net/i/primark/991074998804_01,Conjunto de pijama con pantalones y camiseta,"10,00€"
https://cdn.media.amplience.net/i/primark/991077248504_01,Vaquero elástico de pernera recta,"18,00€"
https://cdn.media.amplience.net/i/primark/991077668706_01,Joggers de pana con bajos ajustados,"22,00€"
https://cdn.media.amplience.net/i/primark/991074078804_01,Camiseta básica de manga larga,"5,00€"
https://cdn.media.amplience.net/i/primark/991007107804_01,Pantalón de sarga formal,"16,00€"
https://cdn.media.amplience.net/i/primark/991056639528_01,Joggers estilo cargo con bajos ajustados,"16,00€"
https://cdn.media.amplience.net/i/primark/991072740002_01,Pack de 3 camisetas base de cuello redondo,"9,00€"
https://cdn.media.amplience.net/i/primark/991038951804_05,Pantalón de traje a medida,"22,00€"
https://cdn.media.amplience.net/i/primark/991079740416_01,Chaqueta con forro de piel de borrego sintética,"35,00€"
https://cdn.media.amplience.net/i/primark/991079759352_01,Cazadora con capucha,"18,00€"
https://cdn.media.amplience.net/i/primark/991074121528_01,Pantalones de pernera cónica con microcuadros,"25,00€"
https://cdn.media.amplience.net/i/primark/991077278804_01,Vaqueros cargo de corte entallado,"25,00€"
https://cdn.media.amplience.net/i/primark/991074998108_01,Conjunto de pijama con pantalones y camiseta,"10,00€"
https://cdn.media.amplience.net/i/primark/991073443414_01,Jersey de cuello redondo otomano,"16,00€"
https://cdn.media.amplience.net/i/primark/991051257804_01,Pantalones de chándal negros de pernera recta,"7,00€"
https://cdn.media.amplience.net/i/primark/991071327704_01,Chaqueta bómber acolchada geométrica,"30,00€"
https://cdn.media.amplience.net/i/primark/991071327616_01,Chaqueta bómber acolchada geométrica,"30,00€"